{
  "id": "core.pet_family.abyssal",
  "name": "Abyssal",
  "lore": "Creatures touched by the Abyss share fragments of its hunger: a few abyssal techniques flow through every bloodline, while each species keeps its own signature. That shared story is why their skills can mix on a bonded pet.",
  "family_shared_skills": [
    "core.skill.abyssal_maw",
    "core.skill.void_step"
  ],
  "species": [
    {
      "creature": "core.creature.gloamfen_stalker",
      "signature_skills": [
        "core.skill.shadow_rend"
      ]
    }
  ],
  "element_signatures": {
    "physical": [
      "core.skill.cleave",
      "core.skill.seismic_slam"
    ],
    "umbral": [
      "core.skill.shadow_rend",
      "core.skill.abyssal_maw"
    ],
    "venom": [
      "core.skill.creeping_mire",
      "core.skill.shrieking_curse"
    ],
    "fire": [
      "core.skill.ember_bolt",
      "core.skill.cinder_breath"
    ],
    "storm": [
      "core.skill.wing_gust",
      "core.skill.ember_screech"
    ],
    "blood": [
      "core.skill.abyssal_maw",
      "core.skill.cleave"
    ],
    "frost": [
      "core.skill.void_step",
      "core.skill.hex_bolt"
    ]
  },
  "archetype_signatures": {
    "stalker": [
      "core.skill.shadow_rend",
      "core.skill.void_step"
    ],
    "lunger": [
      "core.skill.talon_dive",
      "core.skill.cleave"
    ],
    "brute": [
      "core.skill.boulder_hurl",
      "core.skill.seismic_slam"
    ],
    "wisp": [
      "core.skill.hex_bolt",
      "core.skill.wispling_call"
    ],
    "dragon": [
      "core.skill.cinder_breath",
      "core.skill.wing_gust",
      "core.skill.meteor_call"
    ],
    "hag": [
      "core.skill.hex_bolt",
      "core.skill.shrieking_curse",
      "core.skill.wispling_call"
    ],
    "colossus": [
      "core.skill.earthshatter",
      "core.skill.stone_upheaval",
      "core.skill.stone_spikes"
    ]
  },
  "roll_rules": {
    "skill_slots": 3,
    "family_skill_chance": 0.25,
    "attribute_roll_range": {
      "min_pct": 70,
      "max_pct": 110
    }
  }
}
